### ISSUE TITLE
A connection attempt failed because the connected party did not properly respond after a period of time

### ISSUE THREAD

**Issue by aniro** [terraform-providers/terraform-provider-vsphere#773]
Hi there,

### Terraform Version

Terraform v0.12.0 
windows 10 x64

### vSphere Provider Version

provider.vsphere v1.11.0

### Affected Resource(s)

- `vsphere_virtual_machine`

### Debug Output

https://gist.github.com/aniro/460f86f56cce80d2e12de49889924bb6

~/.govmomi/debug/2019-05-28T14-50-26.8232445/1-client.log:
```
2019-05-28T14-53-27.528757400 - 0352:      2ms (*methods.WaitForUpdatesExBody)
2019-05-28T14-58-57.544405000 - 0353: 330007ms (*methods.WaitForUpdatesExBody)
```

Console out:
```
Error: Post https://x.q.e/sdk: read tcp <ip>:64259-><ip>:443: wsarecv: A connection attempt failed because the connected party did not properly respond after a period of time, or established connection failed because connected host has failed to respond.
  on .terraform\modules\edg\linux_vm\main.tf line 1, in resource "vsphere_virtual_machine" "linux_vm":
   1: resource "vsphere_virtual_machine" "linux_vm" {

Error: Post https://x.q.e/sdk: read tcp <ip>:64944-><ip>:443: wsarecv: A connection attempt failed because the connected party did not properly respond after a period of time, or established connection failed because connected host has failed to respond.
  on .terraform\modules\sql\linux_vm\main.tf line 1, in resource "vsphere_virtual_machine" "linux_vm":
   1: resource "vsphere_virtual_machine" "linux_vm" {
```

### Expected Behavior

VM is created

### Actual Behavior

call to vcenter fails at some point and times out after 330 seconds. No attempts to retry are made.
Current configuration spins up about 15 VMs with almost the same config for all VMs. 
Issue is intermittent and can happen on provisioning of any of these VMs.
Increasing parallelism makes more VMs provisionings to fail. While it is still reproducible with parallelism=1.
Timeout has been increased to 30minutes everywhere, still not clear what is 330 seconds timeout.

#### edit:
I figured out that this happens in case TCP session from `terraform-provider-vsphere_v1.11.0_x4` to vsphere is suddenly blocked (by malfunctioning firewall or due to network unavailability) and is consequently timed out according to OS tcp timeout/retransmit settings. In my case it looks like this:
```
 145786 12:53:08,953985    vsphere_ip         client_ip          TCP      60     443 → 58031 [ACK] Seq=1824575 Ack=57958 Win=178176 Len=0
 150160 12:53:38,954541    client_ip          vsphere_ip         TCP      55     [TCP Keep-Alive] 58031 → 443 [ACK] Seq=57957 Ack=1824575 Win=2102272 Len=1
 159917 12:54:08,955143    client_ip          vsphere_ip         TCP      55     [TCP Keep-Alive] 58031 → 443 [ACK] Seq=57957 Ack=1824575 Win=2102272 Len=1
 164939 12:54:38,956065    client_ip          vsphere_ip         TCP      55     [TCP Keep-Alive] 58031 → 443 [ACK] Seq=57957 Ack=1824575 Win=2102272 Len=1
 165897 12:55:08,956748    client_ip          vsphere_ip         TCP      55     [TCP Keep-Alive] 58031 → 443 [ACK] Seq=57957 Ack=1824575 Win=2102272 Len=1
 166709 12:55:38,956152    client_ip          vsphere_ip         TCP      55     [TCP Keep-Alive] 58031 → 443 [ACK] Seq=57957 Ack=1824575 Win=2102272 Len=1
 167274 12:56:08,956378    client_ip          vsphere_ip         TCP      55     [TCP Keep-Alive] 58031 → 443 [ACK] Seq=57957 Ack=1824575 Win=2102272 Len=1
 167933 12:56:38,956474    client_ip          vsphere_ip         TCP      55     [TCP Keep-Alive] 58031 → 443 [ACK] Seq=57957 Ack=1824575 Win=2102272 Len=1
 180753 12:57:08,956547    client_ip          vsphere_ip         TCP      55     [TCP Keep-Alive] 58031 → 443 [ACK] Seq=57957 Ack=1824575 Win=2102272 Len=1
 182454 12:57:38,956542    client_ip          vsphere_ip         TCP      55     [TCP Keep-Alive] 58031 → 443 [ACK] Seq=57957 Ack=1824575 Win=2102272 Len=1
 183259 12:58:08,956324    client_ip          vsphere_ip         TCP      55     [TCP Keep-Alive] 58031 → 443 [ACK] Seq=57957 Ack=1824575 Win=2102272 Len=1
 183757 12:58:38,956569    client_ip          vsphere_ip         TCP      54     58031 → 443 [RST, ACK] Seq=57958 Ack=1824575 Win=0 Len=0
```
The actual problem is that neither Terraform nor vsphere-provider try to recover from this condition. There is no retry logic implemented here.

### Steps to Reproduce

1. `terraform apply`

**Comment by hashibot** [comment]
This issue has been open 180 days with no activity. If this issue is reproducible with the latest version of the provider and with Terraform 0.12, please comment. Otherwise this issue will be closed in 30 days.
